{"format":"craftynor.streams","version":1,"metadata":{"title":"Example video"},"streams":[{"id":"video","url":"https://media.example/video.mp4","role":"video","mimeType":"video/mp4"},{"id":"audio","url":"https://media.example/audio.m4a","role":"audio","mimeType":"audio/mp4"}],"operations":[{"id":"final","type":"mux","inputs":["video","audio"],"container":"mp4"}],"output":{"source":"final","filename":"Example.mp4","mimeType":"video/mp4"}}
