{"format":"craftynor.streams","version":1,"metadata":{"title":"Example segments"},"streams":[{"id":"init","url":"https://media.example/init.mp4","role":"video","mimeType":"video/mp4"},{"id":"part1","url":"https://media.example/segment1.m4s","role":"video","mimeType":"video/mp4"},{"id":"part2","url":"https://media.example/segment2.m4s","role":"video","mimeType":"video/mp4"}],"operations":[{"id":"assembled","type":"merge","inputs":["init","part1","part2"],"mode":"bytes"}],"output":{"source":"assembled","filename":"Example.mp4","mimeType":"video/mp4"}}
